{
  "proof_run_id": "DFIR-FIXTURE-CUSTODY-DRY-RUN-V1",
  "parent_candidate": "PRC-DFIR-CUSTODY",
  "authority_gate_id": "DFIR-FIXTURE-CUSTODY-GATE-001",
  "classification": "INTERNAL_ONLY",
  "execution_scope": "harmless_fixture_only",
  "closure_state": "closed_verified",
  "evidence_manifest_path": "EVIDENCE_MANIFEST.json",
  "hashes_path": "HASHES.sha256",
  "verification_path": "VERIFICATION.json",
  "artifact_hashes": [
    {
      "path": "EVIDENCE_MANIFEST.json",
      "sha256": "81da24d2918c5329c103cd07c65ca2bc0b55b7831191ba45cd5765434deb494d"
    }
  ],
  "stop_condition_triggered": false,
  "limitations": [
    "fixture-only dry run",
    "no live incident response",
    "no forensic acquisition",
    "no malware handling",
    "no legal admissibility claim",
    "no public capability claim"
  ]
}
